{
  "$schema": "https://json-schema.org/draft/2020-12/schema",
  "$id": "https://linea.build/schemas/getZkL2ExecutionProofV1.response.schema.json",
  "title": "getZkL2ExecutionProof V1 response",
  "description": "Prover -> coordinator l2-execution proof response. The shared, versioned contract for the l2-execution guest output (L2ExecutionProof) and the coordinator's Jackson mapper.",
  "type": "object",
  "additionalProperties": false,
  "required": [
    "proverVersion",
    "proof",
    "startBlockNumber",
    "publicInputs",
    "programVk"
  ],
  "properties": {
    "proverVersion": { "type": "string" },
    "proof": { "$ref": "#/$defs/hex" },
    "startBlockNumber": { "$ref": "#/$defs/uint" },
    "publicInputs": {
      "type": "object",
      "additionalProperties": false,
      "required": [
        "parentBlockHash",
        "endBlockHash",
        "endBlockNumber",
        "endBlockTimestamp",
        "l2L1Messages",
        "endL1L2BridgeRollingHash",
        "endL1L2BridgeRollingHashMessageNumber",
        "dynamicChainConfigHash",
        "parentFtxRollingHash",
        "parentFtxNumber",
        "endFtxRollingHash",
        "endProcessedFtxNumber",
        "filteredAddresses",
        "txFromsHash",
        "blockCount",
        "l2MessagingBlocksOffsets"
      ],
      "properties": {
        "parentBlockHash": { "$ref": "#/$defs/hash32" },
        "endBlockHash": { "$ref": "#/$defs/hash32" },
        "endBlockNumber": { "$ref": "#/$defs/uint" },
        "endBlockTimestamp": { "$ref": "#/$defs/uint" },
        "l2L1Messages": { "type": "array", "items": { "$ref": "#/$defs/hash32" } },
        "endL1L2BridgeRollingHash": { "$ref": "#/$defs/hash32" },
        "endL1L2BridgeRollingHashMessageNumber": { "$ref": "#/$defs/uint" },
        "dynamicChainConfigHash": { "$ref": "#/$defs/hash32" },
        "parentFtxRollingHash": { "$ref": "#/$defs/hash32" },
        "parentFtxNumber": { "$ref": "#/$defs/uint" },
        "endFtxRollingHash": { "$ref": "#/$defs/hash32" },
        "endProcessedFtxNumber": { "$ref": "#/$defs/uint" },
        "filteredAddresses": {
          "description": "Distinct, sorted ascending by byte value: the canonical encoding of the set of addresses named by forced transactions refused in this range (order carries no meaning).",
          "type": "array",
          "uniqueItems": true,
          "items": { "$ref": "#/$defs/address" }
        },
        "txFromsHash": { "$ref": "#/$defs/hash32" },
        "blockCount": { "$ref": "#/$defs/uint" },
        "l2MessagingBlocksOffsets": { "type": "array", "items": { "type": "integer", "minimum": 1, "maximum": 65535 } }
      }
    },
    "programVk": { "$ref": "#/$defs/hash32" }
  },
  "$defs": {
    "uint": { "type": "integer", "minimum": 0 },
    "hex": {
      "type": "string",
      "pattern": "^0x([0-9a-fA-F]{2})*$"
    },
    "hash32": {
      "type": "string",
      "pattern": "^0x[0-9a-fA-F]{64}$"
    },
    "address": {
      "type": "string",
      "pattern": "^0x[0-9a-fA-F]{40}$"
    }
  }
}
