{
  "proverVersion": "4.0.0-riscv",
  "proof": "0xdeadbeef",
  "startBlockNumber": 1000501,
  "publicInputs": {
    "parentBlockHash": "0x0a0a0a0a0a0a0a0a0a0a0a0a0a0a0a0a0a0a0a0a0a0a0a0a0a0a0a0a0a0a0a0a",
    "endBlockHash": "0x0b0b0b0b0b0b0b0b0b0b0b0b0b0b0b0b0b0b0b0b0b0b0b0b0b0b0b0b0b0b0b0b",
    "endBlockNumber": 1000503,
    "endBlockTimestamp": 1763000123,
    "endL1L2BridgeRollingHash": "0x0303030303030303030303030303030303030303030303030303030303030303",
    "endL1L2BridgeRollingHashMessageNumber": 5,
    "dynamicChainConfigHash": "0xc0c0c0c0c0c0c0c0c0c0c0c0c0c0c0c0c0c0c0c0c0c0c0c0c0c0c0c0c0c0c0c0",
    "parentFtxRollingHash": "0x0404040404040404040404040404040404040404040404040404040404040404",
    "parentFtxNumber": 15,
    "endFtxRollingHash": "0x0505050505050505050505050505050505050505050505050505050505050505",
    "endProcessedFtxNumber": 18,
    "filteredAddresses": [
      "0x0909090909090909090909090909090909090909"
    ],
    "txFromsHash": "0x0707070707070707070707070707070707070707070707070707070707070707",
    "blockCount": 3,
    "l2MessagingBlocksOffsets": [],
    "l2L1Messages": [
      "0x0808080808080808080808080808080808080808080808080808080808080808"
    ]
  },
  "programVk": "0xaaaaaaaaaaaaaaaaaaaaaaaaaaaaaaaaaaaaaaaaaaaaaaaaaaaaaaaaaaaaaaaa"
}
